id,username,email,phone,age,hosting,about_me,location_id,img_url,street
1,dpoel0,lmullord0@cdc.gov,,31,false,Curabitur convallis. Duis consequat dui nec nisi volutpat eleifend. Donec ut dolor.,2,https://robohash.org/oditabillum.png?size=50x50&set=set1,Truax
2,bshillaker1,ameeks1@twitpic.com,,33,false,Ut tellus.,5,https://robohash.org/quisinventorequi.jpg?size=50x50&set=set1,Graceland
3,lcosley2,fpinkie2@booking.com,2832618494,42,false,,7,https://robohash.org/quiaisteitaque.bmp?size=50x50&set=set1,Morningstar
4,kboyat3,mghelardi3@weibo.com,1908052850,21,false,Duis aliquam convallis nunc. Proin at turpis a pede posuere nonummy.,9,https://robohash.org/voluptasaspernatursunt.png?size=50x50&set=set1,Toban
5,cpellew4,ekirtlan4@ocn.ne.jp,8803078298,,false,Nullam sit amet turpis elementum ligula vehicula consequat. Morbi a ipsum. Integer a nibh.,4,https://robohash.org/iustoexest.bmp?size=50x50&set=set1,Forster
6,batkyns5,agifkins5@amazon.com,6474277515,32,true,"Curabitur gravida nisi at nibh. In hac habitasse platea dictumst. Aliquam augue quam, sollicitudin vitae, consectetuer eget, rutrum at, lorem.",3,https://robohash.org/quonihilratione.png?size=50x50&set=set1,Veith
7,djumeau6,hjurs6@paypal.com,,,true,"Quisque arcu libero, rutrum ac, lobortis vel, dapibus at, diam. Nam tristique tortor eu pede.",9,https://robohash.org/velitearumporro.png?size=50x50&set=set1,Meadow Ridge
8,ntevlin7,yweld7@tuttocitta.it,1871076236,18,false,"Fusce congue, diam id ornare imperdiet, sapien urna pretium nisl, ut volutpat sapien arcu sed augue. Aliquam erat volutpat. In congue.",9,https://robohash.org/suntidsit.png?size=50x50&set=set1,Gale
9,hheinssen8,kmallan8@qq.com,4133172091,25,false,,9,https://robohash.org/autadsit.jpg?size=50x50&set=set1,Thierer
10,dsoloway9,elamasna9@kickstarter.com,3212701045,30,true,Duis mattis egestas metus.,9,https://robohash.org/aliquideanon.jpg?size=50x50&set=set1,Westridge
11,esagea,hdroughta@tinyurl.com,4265415473,47,false,Integer tincidunt ante vel ipsum. Praesent blandit lacinia erat.,7,https://robohash.org/laborumfacereea.jpg?size=50x50&set=set1,Manley
12,lnarduccib,wtockellb@clickbank.net,4265954886,19,true,"Nam ultrices, libero non mattis pulvinar, nulla pede ullamcorper augue, a suscipit nulla elit ac nulla.",7,https://robohash.org/delenitienimblanditiis.png?size=50x50&set=set1,Sycamore
13,educarnec,cmadisonc@oaic.gov.au,9376622677,42,true,Nullam porttitor lacus at turpis. Donec posuere metus vitae ipsum. Aliquam non mauris.,3,https://robohash.org/estetet.bmp?size=50x50&set=set1,Eggendart
14,mdracod,aduleyd@odnoklassniki.ru,3132686190,,true,Pellentesque eget nunc. Donec quis orci eget orci vehicula condimentum. Curabitur in libero ut massa volutpat convallis.,1,https://robohash.org/ipsaquamet.jpg?size=50x50&set=set1,High Crossing
15,hstiveye,uhugonnete@spiegel.de,7236607645,26,false,"Mauris ullamcorper purus sit amet nulla. Quisque arcu libero, rutrum ac, lobortis vel, dapibus at, diam.",8,https://robohash.org/quaeratdistinctiovoluptatibus.jpg?size=50x50&set=set1,Morrow
16,rlamminf,rmorrowf@foxnews.com,8097584787,,false,,6,https://robohash.org/necessitatibusidarchitecto.png?size=50x50&set=set1,Nobel
17,mbidgoodg,rrunhamg@bloglines.com,9333751836,,false,"Cras pellentesque volutpat dui. Maecenas tristique, est et tempus semper, est quam pharetra magna, ac consequat metus sapien ut nunc.",5,https://robohash.org/laboriosameligendinemo.bmp?size=50x50&set=set1,Arkansas
18,drafteryh,teptonh@amazon.co.jp,5515641594,,false,"Nulla ac enim. In tempor, turpis nec euismod scelerisque, quam turpis adipiscing lorem, vitae mattis nibh ligula nec sem.",4,https://robohash.org/assumendamollitiadolor.png?size=50x50&set=set1,Cody
19,mmauni,sdohrmanni@networksolutions.com,6596472603,18,false,Pellentesque viverra pede ac diam.,8,https://robohash.org/accusamusametipsum.jpg?size=50x50&set=set1,Lakeland
20,smatchettj,pthornleyj@theatlantic.com,,60,false,Vestibulum sed magna at nunc commodo placerat. Praesent blandit.,6,https://robohash.org/etmolestiaeet.jpg?size=50x50&set=set1,Mifflin
21,redesk,aspawforthk@php.net,5167067485,,true,,1,https://robohash.org/sitautrecusandae.png?size=50x50&set=set1,Rieder
22,ptolmanl,rmullanel@telegraph.co.uk,3887572900,42,false,,2,https://robohash.org/etineius.bmp?size=50x50&set=set1,Grover
23,ependridm,swilshinm@nasa.gov,7059055796,,false,"Vestibulum quam sapien, varius ut, blandit non, interdum in, ante. Vestibulum ante ipsum primis in faucibus orci luctus et ultrices posuere cubilia Curae; Duis faucibus accumsan odio. Curabitur convallis.",5,https://robohash.org/omnisetvoluptas.jpg?size=50x50&set=set1,Grover
24,cpilipyakn,mrosebyn@rediff.com,1862982705,39,false,"Cras mi pede, malesuada in, imperdiet et, commodo vulputate, justo. In blandit ultrices enim.",2,https://robohash.org/sequianimidolorem.jpg?size=50x50&set=set1,Continental
25,hhumbleso,cnippero@ebay.com,5506138419,,false,"Nulla nisl. Nunc nisl. Duis bibendum, felis sed interdum venenatis, turpis enim blandit mi, in porttitor pede justo eu massa.",9,https://robohash.org/numquameumodit.bmp?size=50x50&set=set1,Starling
26,clygoep,mnewlandsp@seesaa.net,,52,true,"Cum sociis natoque penatibus et magnis dis parturient montes, nascetur ridiculus mus. Vivamus vestibulum sagittis sapien. Cum sociis natoque penatibus et magnis dis parturient montes, nascetur ridiculus mus.",3,https://robohash.org/voluptasettemporibus.jpg?size=50x50&set=set1,Autumn Leaf
27,bmattinq,svicareyq@cloudflare.com,9144325433,50,true,"Lorem ipsum dolor sit amet, consectetuer adipiscing elit. Proin interdum mauris non ligula pellentesque ultrices.",4,https://robohash.org/architectoplaceatfacilis.png?size=50x50&set=set1,Melvin
28,fleslier,lnaryr@eventbrite.com,6051831639,54,true,Quisque ut erat. Curabitur gravida nisi at nibh.,7,https://robohash.org/autesteum.png?size=50x50&set=set1,Bowman
29,nharrolds,csommerlins@example.com,8477647292,37,false,"Cras mi pede, malesuada in, imperdiet et, commodo vulputate, justo. In blandit ultrices enim.",1,https://robohash.org/exautemlabore.png?size=50x50&set=set1,Quincy
30,jbooelnt,vlebarrt@prweb.com,9965128151,,true,Vestibulum ante ipsum primis in faucibus orci luctus et ultrices posuere cubilia Curae; Duis faucibus accumsan odio. Curabitur convallis. Duis consequat dui nec nisi volutpat eleifend.,4,https://robohash.org/etmolestiasaperiam.png?size=50x50&set=set1,Hoard
31,qkibbyu,pmanuelyu@wp.com,9465708576,,false,Maecenas tincidunt lacus at velit. Vivamus vel nulla eget eros elementum pellentesque.,1,https://robohash.org/voluptatemofficiisvelit.bmp?size=50x50&set=set1,Cascade
32,gtedmanv,lfiltnessv@typepad.com,4945229945,,true,Donec dapibus. Duis at velit eu est congue elementum.,5,https://robohash.org/asperioresperferendisvel.png?size=50x50&set=set1,Prairieview
33,bentresw,bharringtonw@seattletimes.com,,20,false,Aenean lectus. Pellentesque eget nunc. Donec quis orci eget orci vehicula condimentum.,10,https://robohash.org/porrosinttempora.png?size=50x50&set=set1,Merchant
34,cmcaleesx,snarramorex@abc.net.au,6756765297,28,true,Vestibulum ante ipsum primis in faucibus orci luctus et ultrices posuere cubilia Curae; Mauris viverra diam vitae quam. Suspendisse potenti.,10,https://robohash.org/modiiustodistinctio.png?size=50x50&set=set1,Sherman
35,amedgwicky,wpuddicombey@sbwire.com,8618254658,32,false,,6,https://robohash.org/voluptasetmolestias.png?size=50x50&set=set1,Manley
36,csellwoodz,trodingerz@sfgate.com,6484423126,,false,Nulla tellus.,2,https://robohash.org/estmaioreslibero.bmp?size=50x50&set=set1,Spenser
37,pbickerdyke10,aarchbell10@ezinearticles.com,5288040039,43,false,"Vestibulum quam sapien, varius ut, blandit non, interdum in, ante.",9,https://robohash.org/beataerepellatexpedita.png?size=50x50&set=set1,Anhalt
38,dfairbank11,vtipton11@elegantthemes.com,8972948855,,true,"Praesent lectus. Vestibulum quam sapien, varius ut, blandit non, interdum in, ante.",10,https://robohash.org/suntquodicta.png?size=50x50&set=set1,Red Cloud
39,hcosely12,fsansom12@biblegateway.com,,54,false,"Fusce congue, diam id ornare imperdiet, sapien urna pretium nisl, ut volutpat sapien arcu sed augue.",7,https://robohash.org/autsintfuga.jpg?size=50x50&set=set1,Monterey
40,tdorricott13,dkaye13@slideshare.net,9998483945,59,true,,4,https://robohash.org/idrecusandaebeatae.png?size=50x50&set=set1,Autumn Leaf
41,alawie14,bangel14@merriam-webster.com,8917200998,,false,,4,https://robohash.org/hicprovidentaliquid.bmp?size=50x50&set=set1,Prairie Rose
42,cdennis15,ocastagno15@icq.com,6618668115,23,false,,5,https://robohash.org/delenitiearumaut.bmp?size=50x50&set=set1,Buena Vista
43,gessel16,otallent16@joomla.org,2742569012,,true,Pellentesque ultrices mattis odio.,2,https://robohash.org/voluptatibusrepudiandaedolores.bmp?size=50x50&set=set1,Eliot
44,jelleton17,jboffey17@dmoz.org,9944861020,,true,In eleifend quam a odio.,5,https://robohash.org/idvoluptasvoluptas.png?size=50x50&set=set1,Marcy
45,lkime18,srummins18@miitbeian.gov.cn,7892153122,57,false,,9,https://robohash.org/autestet.png?size=50x50&set=set1,Burrows
46,bbath19,smonkhouse19@umich.edu,3831599959,,false,Aenean fermentum. Donec ut mauris eget massa tempor convallis.,7,https://robohash.org/autrationead.bmp?size=50x50&set=set1,Haas
47,bhampe1a,lhebron1a@mozilla.com,1751791618,59,false,"Aliquam sit amet diam in magna bibendum imperdiet. Nullam orci pede, venenatis non, sodales sed, tincidunt eu, felis.",2,https://robohash.org/uttemporibusveniam.png?size=50x50&set=set1,Nancy
48,tragles1b,ejealous1b@phpbb.com,3428005264,,true,,6,https://robohash.org/nihilquireiciendis.bmp?size=50x50&set=set1,Fallview
49,rkhomishin1c,nboake1c@mashable.com,3977189395,60,true,In hac habitasse platea dictumst. Etiam faucibus cursus urna. Ut tellus.,3,https://robohash.org/harumrerumnihil.bmp?size=50x50&set=set1,Ludington
50,fgilbane1d,npersicke1d@nsw.gov.au,8554281334,52,true,"Vestibulum ac est lacinia nisi venenatis tristique. Fusce congue, diam id ornare imperdiet, sapien urna pretium nisl, ut volutpat sapien arcu sed augue.",2,https://robohash.org/suntquasisimilique.png?size=50x50&set=set1,Chive
51,bengeham1e,rchill1e@free.fr,3595813491,44,false,"Vestibulum quam sapien, varius ut, blandit non, interdum in, ante.",7,https://robohash.org/necessitatibusetodio.png?size=50x50&set=set1,Gulseth
52,dputtrell1f,ktumini1f@cnet.com,4599534382,54,true,Nullam porttitor lacus at turpis.,9,https://robohash.org/voluptateminciduntcum.jpg?size=50x50&set=set1,Northland
53,dvanbaaren1g,sturban1g@goodreads.com,9157489637,45,true,"In sagittis dui vel nisl. Duis ac nibh. Fusce lacus purus, aliquet at, feugiat non, pretium quis, lectus.",2,https://robohash.org/fugiatvoluptatibusporro.bmp?size=50x50&set=set1,Kingsford
54,ecobbe1h,dleguay1h@berkeley.edu,4213610164,44,true,,8,https://robohash.org/nullaabnam.png?size=50x50&set=set1,Lake View
55,abodicum1i,abraycotton1i@fastcompany.com,9296846320,34,false,Suspendisse potenti.,5,https://robohash.org/corporisconsequaturhic.png?size=50x50&set=set1,Lakewood
56,dscholar1j,bclaire1j@zdnet.com,,,false,Nulla tellus. In sagittis dui vel nisl. Duis ac nibh.,6,https://robohash.org/quiadoloreculpa.jpg?size=50x50&set=set1,Sycamore
57,mworthington1k,cshenley1k@mac.com,5251867844,,true,Morbi non quam nec dui luctus rutrum. Nulla tellus. In sagittis dui vel nisl.,3,https://robohash.org/liberoquisquamnobis.bmp?size=50x50&set=set1,Kipling
58,aroiz1l,llamborn1l@fema.gov,,40,true,"Curabitur gravida nisi at nibh. In hac habitasse platea dictumst. Aliquam augue quam, sollicitudin vitae, consectetuer eget, rutrum at, lorem.",2,https://robohash.org/quamtemporedolor.png?size=50x50&set=set1,Fordem
59,mtweed1m,lleefe1m@washington.edu,6812284529,32,true,,10,https://robohash.org/inetharum.png?size=50x50&set=set1,David
60,eclausner1n,vathelstan1n@histats.com,2468732362,23,false,,2,https://robohash.org/aliquidcumautem.jpg?size=50x50&set=set1,Amoth
61,haddess1o,rjindra1o@digg.com,,33,true,"Cum sociis natoque penatibus et magnis dis parturient montes, nascetur ridiculus mus.",2,https://robohash.org/suntetofficiis.bmp?size=50x50&set=set1,Doe Crossing
62,msugarman1p,emillion1p@amazon.co.jp,,,true,"Mauris enim leo, rhoncus sed, vestibulum sit amet, cursus id, turpis.",10,https://robohash.org/nullaetet.png?size=50x50&set=set1,Prairie Rose
63,ckimblen1q,gswain1q@miibeian.gov.cn,,,true,Pellentesque eget nunc. Donec quis orci eget orci vehicula condimentum. Curabitur in libero ut massa volutpat convallis.,2,https://robohash.org/estveltempora.png?size=50x50&set=set1,Westend
64,gsimoncini1r,cparncutt1r@ezinearticles.com,8956817405,27,false,In sagittis dui vel nisl. Duis ac nibh.,2,https://robohash.org/eiuseasunt.jpg?size=50x50&set=set1,Kedzie
65,inegus1s,ggopsill1s@go.com,,29,true,"Quisque porta volutpat erat. Quisque erat eros, viverra eget, congue eget, semper rutrum, nulla.",8,https://robohash.org/voluptatemsitlaborum.bmp?size=50x50&set=set1,Shasta
66,mschlag1t,acardenosa1t@last.fm,1446535133,20,false,In sagittis dui vel nisl.,2,https://robohash.org/quisquamvoluptatemcommodi.png?size=50x50&set=set1,Clyde Gallagher
67,cmacpherson1u,mganing1u@sbwire.com,,,true,Nullam varius. Nulla facilisi. Cras non velit nec nisi vulputate nonummy.,10,https://robohash.org/autverooptio.jpg?size=50x50&set=set1,Paget
68,asummers1v,nhargie1v@dailymotion.com,5336944147,34,true,Maecenas rhoncus aliquam lacus. Morbi quis tortor id nulla ultrices aliquet.,8,https://robohash.org/autinmollitia.bmp?size=50x50&set=set1,Spohn
69,cfilippov1w,rbroadwood1w@weather.com,7862142548,36,true,Etiam pretium iaculis justo. In hac habitasse platea dictumst.,1,https://robohash.org/adquamconsequatur.png?size=50x50&set=set1,Monterey
70,mlared1x,iguile1x@sourceforge.net,,31,false,Vestibulum sed magna at nunc commodo placerat. Praesent blandit. Nam nulla.,9,https://robohash.org/voluptasremet.png?size=50x50&set=set1,Rieder
71,bmitrikhin1y,bganforthe1y@alibaba.com,8146882200,51,false,Phasellus sit amet erat. Nulla tempus. Vivamus in felis eu sapien cursus vestibulum.,9,https://robohash.org/quiaullamexpedita.jpg?size=50x50&set=set1,Johnson
72,tmarkovic1z,tderobertis1z@mac.com,3242015516,40,true,Maecenas tincidunt lacus at velit.,6,https://robohash.org/delectusetenim.jpg?size=50x50&set=set1,Forest Dale
73,mgaymar20,isketchley20@zdnet.com,,42,true,"In tempor, turpis nec euismod scelerisque, quam turpis adipiscing lorem, vitae mattis nibh ligula nec sem. Duis aliquam convallis nunc.",8,https://robohash.org/veroharumrerum.bmp?size=50x50&set=set1,Haas
74,mgrimston21,kdetheridge21@xing.com,8143603111,,true,Etiam pretium iaculis justo. In hac habitasse platea dictumst. Etiam faucibus cursus urna.,10,https://robohash.org/laboriosamculpaodit.bmp?size=50x50&set=set1,Porter
75,rstitfall22,ojeves22@sina.com.cn,3576396631,,true,Aenean fermentum. Donec ut mauris eget massa tempor convallis.,7,https://robohash.org/temporibusconsecteturet.jpg?size=50x50&set=set1,Delaware
76,hknutton23,ablanchet23@vistaprint.com,3568850263,,false,Nulla suscipit ligula in lacus. Curabitur at ipsum ac tellus semper interdum.,6,https://robohash.org/quosexcepturiesse.bmp?size=50x50&set=set1,Fuller
77,mlickess24,jwalcar24@4shared.com,8092944470,21,true,,3,https://robohash.org/nihilinut.png?size=50x50&set=set1,Killdeer
78,bmcgarel25,mmelia25@princeton.edu,,50,false,"Vestibulum ante ipsum primis in faucibus orci luctus et ultrices posuere cubilia Curae; Nulla dapibus dolor vel est. Donec odio justo, sollicitudin ut, suscipit a, feugiat et, eros. Vestibulum ac est lacinia nisi venenatis tristique.",10,https://robohash.org/voluptatematnihil.bmp?size=50x50&set=set1,Maryland
79,fkreutzer26,ahartley26@skype.com,1803896290,,false,Aliquam erat volutpat. In congue.,10,https://robohash.org/saepenihilunde.bmp?size=50x50&set=set1,Saint Paul
80,mbarrus27,ggillyatt27@omniture.com,,,true,"Curabitur at ipsum ac tellus semper interdum. Mauris ullamcorper purus sit amet nulla. Quisque arcu libero, rutrum ac, lobortis vel, dapibus at, diam.",2,https://robohash.org/numquamsuscipitcum.bmp?size=50x50&set=set1,Eagle Crest
81,ubywater28,kbollis28@mapy.cz,9615679911,48,false,,1,https://robohash.org/quisquovel.jpg?size=50x50&set=set1,Tennyson
82,jarling29,vcofax29@sohu.com,9646755213,20,true,"Aenean sit amet justo. Morbi ut odio. Cras mi pede, malesuada in, imperdiet et, commodo vulputate, justo.",3,https://robohash.org/inventoreetnumquam.jpg?size=50x50&set=set1,Northland
83,jwalasik2a,cpostlethwaite2a@bing.com,6348967493,,true,Suspendisse potenti.,9,https://robohash.org/sintaccusantiumvoluptas.bmp?size=50x50&set=set1,Forest
84,lscrace2b,cdunabie2b@a8.net,8959447133,41,true,Mauris ullamcorper purus sit amet nulla.,9,https://robohash.org/praesentiumrerumdolor.jpg?size=50x50&set=set1,Monica
85,fbesque2c,chindes2c@nifty.com,5239769059,,true,"Cras in purus eu magna vulputate luctus. Cum sociis natoque penatibus et magnis dis parturient montes, nascetur ridiculus mus. Vivamus vestibulum sagittis sapien.",8,https://robohash.org/autassumendaut.bmp?size=50x50&set=set1,Riverside
86,jizat2d,oagates2d@themeforest.net,,44,true,Aenean fermentum.,5,https://robohash.org/doloremaspernaturbeatae.jpg?size=50x50&set=set1,Kim
87,vjandl2e,nperkinson2e@nps.gov,,,false,Vestibulum ante ipsum primis in faucibus orci luctus et ultrices posuere cubilia Curae; Mauris viverra diam vitae quam. Suspendisse potenti.,6,https://robohash.org/estducimusut.bmp?size=50x50&set=set1,Pleasure
88,fcorsham2f,dpogosian2f@dailymotion.com,4913499623,,false,,2,https://robohash.org/voluptasofficiavoluptatum.jpg?size=50x50&set=set1,Continental
89,hwigfall2g,ltuffin2g@wikispaces.com,3933460933,,false,Nulla suscipit ligula in lacus.,10,https://robohash.org/ipsaporroaut.png?size=50x50&set=set1,Kinsman
90,kmulligan2h,aspaight2h@usa.gov,,59,true,"Duis bibendum, felis sed interdum venenatis, turpis enim blandit mi, in porttitor pede justo eu massa.",3,https://robohash.org/minimasolutased.jpg?size=50x50&set=set1,Lien
91,gskeermer2i,jchrister2i@pbs.org,9642693163,48,false,In eleifend quam a odio.,1,https://robohash.org/illoeumexercitationem.jpg?size=50x50&set=set1,Debs
92,bnewlove2j,gjepperson2j@dot.gov,9687532602,31,true,"Cras mi pede, malesuada in, imperdiet et, commodo vulputate, justo. In blandit ultrices enim.",7,https://robohash.org/etliberomaxime.jpg?size=50x50&set=set1,Meadow Valley
93,jbees2k,gstanners2k@wikispaces.com,3293961295,,true,Integer tincidunt ante vel ipsum. Praesent blandit lacinia erat.,7,https://robohash.org/fugitquosvoluptas.jpg?size=50x50&set=set1,Surrey
94,atesh2l,dcastro2l@barnesandnoble.com,7039362374,,false,Duis ac nibh.,10,https://robohash.org/maximerepudiandaeiusto.jpg?size=50x50&set=set1,1st
95,cstawell2m,auttridge2m@theatlantic.com,,30,true,Morbi porttitor lorem id ligula. Suspendisse ornare consequat lectus.,4,https://robohash.org/doloreaqueoptio.png?size=50x50&set=set1,Westend
96,yfyldes2n,mghidini2n@ask.com,,,true,"Fusce posuere felis sed lacus. Morbi sem mauris, laoreet ut, rhoncus aliquet, pulvinar sed, nisl. Nunc rhoncus dui vel sem.",5,https://robohash.org/cumqueitaqueodio.jpg?size=50x50&set=set1,Carpenter
97,ckayley2o,pbernet2o@github.io,3732809489,52,false,"In hac habitasse platea dictumst. Morbi vestibulum, velit id pretium iaculis, diam erat fermentum justo, nec condimentum neque sapien placerat ante. Nulla justo.",10,https://robohash.org/molestiaeoccaecatidolore.png?size=50x50&set=set1,Grasskamp
98,hficken2p,gsobey2p@noaa.gov,3831541931,54,true,Donec posuere metus vitae ipsum.,5,https://robohash.org/atquamad.bmp?size=50x50&set=set1,Pleasure
99,bjoyner2q,kdavidsen2q@fc2.com,4375151284,23,true,Aliquam quis turpis eget elit sodales scelerisque. Mauris sit amet eros. Suspendisse accumsan tortor quis turpis.,1,https://robohash.org/auteosquos.jpg?size=50x50&set=set1,Sutteridge
100,shorick2r,asnow2r@nifty.com,3489438568,,true,"Cras mi pede, malesuada in, imperdiet et, commodo vulputate, justo. In blandit ultrices enim.",5,https://robohash.org/veniamipsumcupiditate.png?size=50x50&set=set1,Glendale
101,lspraggs2s,ilymbourne2s@cdc.gov,4475951444,,true,,8,https://robohash.org/cumquidolores.jpg?size=50x50&set=set1,Stang
102,draffan2t,kaleksandrov2t@list-manage.com,7465355671,,true,,3,https://robohash.org/doloribuscupiditatererum.jpg?size=50x50&set=set1,Farwell
103,myegorev2u,ocorney2u@marketwatch.com,,,false,"Nunc rhoncus dui vel sem. Sed sagittis. Nam congue, risus semper porta volutpat, quam pede lobortis ligula, sit amet eleifend pede libero quis orci.",1,https://robohash.org/ducimusmolestiaefugiat.jpg?size=50x50&set=set1,Darwin
104,jbrunning2v,jiorizzo2v@drupal.org,3542076103,32,false,Proin risus. Praesent lectus.,3,https://robohash.org/mollitialaudantiumtempora.png?size=50x50&set=set1,Memorial
105,cbackshill2w,cfynn2w@gmpg.org,8022852475,,true,"Maecenas tristique, est et tempus semper, est quam pharetra magna, ac consequat metus sapien ut nunc.",4,https://robohash.org/mollitiaquiqui.jpg?size=50x50&set=set1,Kedzie
106,loxborough2x,hlanfranchi2x@msu.edu,8584152521,20,false,"Phasellus id sapien in sapien iaculis congue. Vivamus metus arcu, adipiscing molestie, hendrerit at, vulputate vitae, nisl. Aenean lectus.",6,https://robohash.org/autenimeaque.jpg?size=50x50&set=set1,West
107,mpharrow2y,btindall2y@about.me,8964444620,44,true,"Quisque porta volutpat erat. Quisque erat eros, viverra eget, congue eget, semper rutrum, nulla. Nunc purus.",7,https://robohash.org/deseruntnatusconsectetur.bmp?size=50x50&set=set1,Hanover
108,mchatwin2z,fbrettoner2z@scientificamerican.com,5277327100,,true,"Proin leo odio, porttitor id, consequat in, consequat ut, nulla. Sed accumsan felis. Ut at dolor quis odio consequat varius.",6,https://robohash.org/dolorumnecessitatibuslaudantium.png?size=50x50&set=set1,Nova
109,dgallyon30,soleshunin30@123-reg.co.uk,6704835586,60,false,"Morbi vel lectus in quam fringilla rhoncus. Mauris enim leo, rhoncus sed, vestibulum sit amet, cursus id, turpis. Integer aliquet, massa id lobortis convallis, tortor risus dapibus augue, vel accumsan tellus nisi eu orci.",5,https://robohash.org/temporibusrerummodi.jpg?size=50x50&set=set1,Annamark
110,dludovici31,sbugg31@ft.com,5481388170,32,true,"Aliquam augue quam, sollicitudin vitae, consectetuer eget, rutrum at, lorem. Integer tincidunt ante vel ipsum.",2,https://robohash.org/quisquamquasisequi.png?size=50x50&set=set1,Lotheville
111,vleban32,kniemetz32@dedecms.com,,,false,Aenean fermentum.,1,https://robohash.org/rerumvelsint.jpg?size=50x50&set=set1,Dawn
112,jspaule33,kabramovic33@prlog.org,1451175673,49,true,,4,https://robohash.org/doloreseaeum.png?size=50x50&set=set1,New Castle
113,mbrassill34,hoddboy34@xinhuanet.com,1266658538,21,true,"In tempor, turpis nec euismod scelerisque, quam turpis adipiscing lorem, vitae mattis nibh ligula nec sem. Duis aliquam convallis nunc. Proin at turpis a pede posuere nonummy.",7,https://robohash.org/nonanatus.jpg?size=50x50&set=set1,Express
114,ggunby35,ndauby35@intel.com,8908141357,,true,,4,https://robohash.org/quodeosincidunt.png?size=50x50&set=set1,Hollow Ridge
115,gdwight36,khebbron36@yale.edu,3906148659,44,true,,4,https://robohash.org/remexeligendi.png?size=50x50&set=set1,Starling
116,dgrayham37,kpearcy37@studiopress.com,2494144482,36,false,,6,https://robohash.org/repellatiddolores.png?size=50x50&set=set1,Mccormick
117,adinsdale38,sullrich38@sciencedirect.com,3847320634,25,false,,2,https://robohash.org/voluptatemconsequaturnostrum.png?size=50x50&set=set1,Bluestem
118,nstamp39,dconman39@paginegialle.it,5849515274,22,true,,8,https://robohash.org/doloribusfacereenim.bmp?size=50x50&set=set1,Bunting
119,scolumbine3a,mgarner3a@i2i.jp,6853604136,21,false,Nam tristique tortor eu pede.,9,https://robohash.org/facereutatque.png?size=50x50&set=set1,Schmedeman
120,kjosipovic3b,rsidwell3b@artisteer.com,2545085995,51,false,Integer ac leo. Pellentesque ultrices mattis odio.,3,https://robohash.org/sedaspernaturdistinctio.bmp?size=50x50&set=set1,Park Meadow
121,srosenthal3c,yseydlitz3c@walmart.com,,18,true,Etiam faucibus cursus urna. Ut tellus. Nulla ut erat id mauris vulputate elementum.,8,https://robohash.org/consecteturaccusantiumsed.png?size=50x50&set=set1,John Wall
122,lkail3d,gsarge3d@multiply.com,2762159926,32,true,"Lorem ipsum dolor sit amet, consectetuer adipiscing elit.",2,https://robohash.org/errorveromolestias.bmp?size=50x50&set=set1,Ryan
123,dgerardot3e,lcaswell3e@amazon.co.jp,2896944472,,false,Sed ante.,7,https://robohash.org/autemmolestiasest.bmp?size=50x50&set=set1,Hanson
124,aensten3f,jarcase3f@ustream.tv,,37,false,Ut at dolor quis odio consequat varius.,1,https://robohash.org/sintnullaexplicabo.bmp?size=50x50&set=set1,Merchant
125,alangland3g,phuddart3g@uiuc.edu,4058423380,52,true,"Donec vitae nisi. Nam ultrices, libero non mattis pulvinar, nulla pede ullamcorper augue, a suscipit nulla elit ac nulla. Sed vel enim sit amet nunc viverra dapibus.",1,https://robohash.org/cupiditateiustocumque.bmp?size=50x50&set=set1,Algoma
126,mchevalier3h,cessery3h@google.com.br,7225400973,27,false,Etiam vel augue.,5,https://robohash.org/utquasaliquid.bmp?size=50x50&set=set1,Springs
127,lmckay3i,dsimonian3i@canalblog.com,1288787895,50,false,,2,https://robohash.org/quomollitiavoluptatem.jpg?size=50x50&set=set1,Fairview
128,bricioppo3j,uwarlton3j@zimbio.com,1902479842,39,false,"Vestibulum ante ipsum primis in faucibus orci luctus et ultrices posuere cubilia Curae; Nulla dapibus dolor vel est. Donec odio justo, sollicitudin ut, suscipit a, feugiat et, eros.",4,https://robohash.org/autemenimqui.bmp?size=50x50&set=set1,Alpine
129,gcheltnam3k,ctabor3k@businesswire.com,1553675404,42,false,"Cum sociis natoque penatibus et magnis dis parturient montes, nascetur ridiculus mus.",8,https://robohash.org/eaquenonsoluta.jpg?size=50x50&set=set1,Merry
130,gpentercost3l,wduffy3l@bloomberg.com,4342257052,40,true,,2,https://robohash.org/temporamodirepellendus.bmp?size=50x50&set=set1,Pearson
131,awoolmer3m,mbrannon3m@umn.edu,5074692576,22,true,Pellentesque viverra pede ac diam. Cras pellentesque volutpat dui.,6,https://robohash.org/sedsequidelectus.png?size=50x50&set=set1,Homewood
